{
  "subsystem": "foundation-bridge",
  "subject": "NSRunLoop.CFRunLoop bridge",
  "subject_kind": "behavior",
  "source_artifact": {
    "path": "/Users/vaithianathan/revOS-work/cache/foundation-bridge/cls3",
    "sha256": "dfa338ebe605f7ee414df6813cb1ffffba902adc325e9bbc1d7faca7661bb7a8",
    "format": "other"
  },
  "observation": {
    "tool": "other",
    "tool_invocation": "/Users/vaithianathan/revOS-work/cache/foundation-bridge/cls3",
    "summary": "Runtime probe iterates class_copyMethodList() on NSRunLoop. The NSRunLoop bridge API surface is observed as both instance and class methods: -getCFRunLoop (instance) plus +currentRunLoop and +mainRunLoop (class methods), together with the canonical -run, -runUntilDate:, -runMode:beforeDate: instance methods and -acceptInputForMode:beforeDate: / -addPort:forMode: / -addTimer:forMode: / -performSelector:target:argument:order:modes: / -performBlock: family for dispatching work into the loop.",
    "raw_output_excerpt": "=== NSRunLoop ===\n  -  getCFRunLoop\n  -  run\n  -  runUntilDate:\n  -  runMode:beforeDate:\n  -  runMode:untilDate:\n  -  acceptInputForMode:beforeDate:\n  -  addPort:forMode:\n  -  addTimer:forMode:\n  -  removePort:forMode:\n  -  removeTimer:forMode:\n  -  performSelector:target:argument:order:modes:\n  +  currentRunLoop\n  +  mainRunLoop"
  },
  "claim": "NSRunLoop publishes a public -getCFRunLoop instance method that returns the embedded CFRunLoopRef, plus +currentRunLoop / +mainRunLoop class factories; this is the documented NSRunLoop ↔ CFRunLoop bridge entry point.",
  "claim_status": "observed",
  "cross_reference": [
    {
      "upstream": "swift-corelibs-foundation",
      "label": "RunLoop.swift Swift reimplementation (no CFRunLoop bridge; -getCFRunLoop is private/Apple-only)",
      "url": "https://github.com/apple/swift-corelibs-foundation/blob/main/Sources/Foundation/RunLoop.swift"
    },
    {
      "upstream": "opensource-apple/cf",
      "label": "CFRunLoop.h header (canonical CFRunLoopRef)",
      "url": "https://github.com/apple-oss-distributions/CF/blob/master/CFRunLoop.h"
    }
  ],
  "confidence": 0.95,
  "reproducer": "clang -arch arm64e -fobjc-arc -framework Foundation -o /tmp/cls3 /tmp/cls3.m && /tmp/cls3 | grep -E 'getCFRunLoop|currentRunLoop|mainRunLoop'"
}
