{
  "subsystem": "foundation-bridge",
  "subject": "addObserver:forKeyPath:options:context:",
  "subject_kind": "symbol",
  "source_artifact": {
    "path": "/Users/vaithianathan/revOS-work/cache/foundation-bridge/cls",
    "sha256": "2ac3703bd1eee7083720321870269ca487d31335572ee7b06ef1569c2a7b83bc",
    "format": "other"
  },
  "observation": {
    "tool": "other",
    "tool_invocation": "/Users/vaithianathan/revOS-work/cache/foundation-bridge/cls",
    "summary": "Runtime probe iterates class_copyMethodList() on NSObject and observes the standard KVO API surface as instance methods: addObserver:forKeyPath:options:context:, removeObserver:forKeyPath:, removeObserver:forKeyPath:context:, observeValueForKeyPath:ofObject:change:context: plus private helpers _addObserver:forProperty:options:context: / _removeObserver:forProperty:. NSArray additionally exposes the to-many variants addObserver:toObjectsAtIndexes:forKeyPath:options:context: and removeObserver:fromObjectsAtIndexes:forKeyPath:.",
    "raw_output_excerpt": "=== NSObject ===\n  method_count=290\n    addObserver:forKeyPath:options:context:\n    removeObserver:forKeyPath:\n    removeObserver:forKeyPath:context:\n    observeValueForKeyPath:ofObject:change:context:\n    _addObserver:forProperty:options:context:\n    _removeObserver:forProperty:"
  },
  "claim": "NSObject is the KVO root class and exports -addObserver:forKeyPath:options:context: plus the matching -removeObserver / -observeValueForKeyPath:ofObject:change:context: API surface as public instance methods (the private _addObserver:forProperty:_ helpers are also visible via class_copyMethodList but are documented as private).",
  "claim_status": "observed",
  "cross_reference": [
    {
      "upstream": "opensource-apple/foundation",
      "label": "NSKeyValueObserving.h public header",
      "url": "https://github.com/apple-oss-distributions/CarbonHeaders/blob/master/Foundation/NSKeyValueObserving.h"
    },
    {
      "upstream": "swift-corelibs-foundation",
      "label": "Swift reimplementation does NOT implement KVO at all (no addObserver: implementation; the project README acknowledges this)",
      "url": "https://github.com/apple/swift-corelibs-foundation/blob/main/Sources/Foundation/NSObject.swift"
    }
  ],
  "confidence": 0.95,
  "reproducer": "clang -arch arm64e -fobjc-arc -framework Foundation -o /tmp/cls /tmp/cls.m && /tmp/cls | grep -E 'addObserver|removeObserver|observeValue'"
}
