{
  "subsystem": "foundation-bridge",
  "subject": "CFDictionaryRef<->NSDictionary*",
  "subject_kind": "behavior",
  "source_artifact": {
    "path": "/Users/vaithianathan/revOS-work/cache/foundation-bridge/bridge",
    "sha256": "ce52d7d5eaebe090d798565ecfa2db33d9b5730c45236e9b30f750bc5347c9c4",
    "format": "other"
  },
  "observation": {
    "tool": "other",
    "tool_invocation": "/Users/vaithianathan/revOS-work/cache/foundation-bridge/bridge",
    "summary": "Runtime probe creates a NSDictionary literal @{@\"k\": @\"v\"} and casts it as CFTypeRef; CFGetTypeID() returns 18, identical to CFDictionaryGetTypeID() (also 18). Identity is preserved.",
    "raw_output_excerpt": "NSDictionary -> CFDictionary: ns=0x10076c168 cf=OK (id match? expected=18 got=18)"
  },
  "claim": "On this host CFDictionaryRef is identity-preserved with NSDictionary* under __bridge cast and CFGetTypeID() matches CFDictionaryGetTypeID() (18), confirming the CFDictionary<->NSDictionary toll-free bridge.",
  "claim_status": "observed",
  "cross_reference": [
    {
      "upstream": "opensource-apple/foundation",
      "label": "_tollFreeBridgedTypes",
      "url": "https://github.com/apple-oss-distributions/objc4/blob/main/runtime/Foundation.h"
    },
    {
      "upstream": "swift-corelibs-foundation",
      "label": "Dictionary.swift (Swift reimplementation)",
      "url": "https://github.com/apple/swift-corelibs-foundation/blob/main/Sources/Foundation/Dictionary.swift"
    }
  ],
  "confidence": 0.95,
  "reproducer": "clang -arch arm64e -fobjc-arc -framework Foundation -framework CoreFoundation -o /tmp/bridge /tmp/bridge.m && /tmp/bridge | grep -E '^NSDictionary'"
}
